{
  "$schema": "https://raw.githubusercontent.com/alimtvnetwork/Antigravity-Manager/main/02-spec/schema/releases-manifest.schema.json",
  "generated_at": "2026-10-20T09:17:45.888Z",
  "repo": "alimtvnetwork/Antigravity-Manager",
  "latest_version": "4.240.1",
  "latest_tag": "v4.240.1",
  "latest_tag_url": "https://github.com/alimtvnetwork/Antigravity-Manager/releases/tag/v4.240.1",
  "latest_raw_tag_url": "https://raw.githubusercontent.com/alimtvnetwork/Antigravity-Manager/v4.240.1",
  "releases": [
    {
      "version": "4.240.1",
      "tag": "v4.240.1",
      "tag_url": "https://github.com/alimtvnetwork/Antigravity-Manager/releases/tag/v4.240.1",
      "raw_tag_url": "https://raw.githubusercontent.com/alimtvnetwork/Antigravity-Manager/v4.240.1",
      "release_url": "https://github.com/alimtvnetwork/Antigravity-Manager/releases/tag/v4.240.1",
      "published_at": "2026-10-20T09:17:45Z",
      "prerelease": false,
      "assets": {
        "windows_x64_setup": "https://github.com/alimtvnetwork/Antigravity-Manager/releases/download/v4.240.1/agm-alim-setup.exe",
        "windows_x64_zip": "https://github.com/alimtvnetwork/Antigravity-Manager/releases/download/v4.240.1/agm-alim_4.240.1_windows_x64.zip",
        "windows_x64_msi": "",
        "macos_x64_dmg": "https://github.com/alimtvnetwork/Antigravity-Manager/releases/download/v4.240.1/Antigravity.Manager.Tools_4.240.1_x64.dmg",
        "macos_aarch64_dmg": "https://github.com/alimtvnetwork/Antigravity-Manager/releases/download/v4.240.1/Antigravity.Manager.Tools_4.240.1_aarch64.dmg",
        "linux_amd64_appimage": "",
        "linux_aarch64_appimage": "",
        "linux_amd64_deb": "https://github.com/alimtvnetwork/Antigravity-Manager/releases/download/v4.240.1/Antigravity.Manager.Tools_4.240.1_amd64.deb",
        "linux_aarch64_deb": "https://github.com/alimtvnetwork/Antigravity-Manager/releases/download/v4.240.1/Antigravity.Manager.Tools_4.240.1_arm64.deb",
        "linux_x64_rpm": "",
        "linux_aarch64_rpm": ""
      }
    },
    {
      "version": "4.240.0",
      "tag": "v4.240.0",
      "tag_url": "https://github.com/alimtvnetwork/Antigravity-Manager/releases/tag/v4.240.0",
      "raw_tag_url": "https://raw.githubusercontent.com/alimtvnetwork/Antigravity-Manager/v4.240.0",
      "release_url": "https://github.com/alimtvnetwork/Antigravity-Manager/releases/tag/v4.240.0",
      "published_at": "2026-10-20T08:11:36Z",
      "prerelease": false,
      "assets": {
        "windows_x64_setup": "https://github.com/alimtvnetwork/Antigravity-Manager/releases/download/v4.240.0/agm-alim-setup.exe",
        "windows_x64_zip": "https://github.com/alimtvnetwork/Antigravity-Manager/releases/download/v4.240.0/agm-alim_4.240.0_windows_x64.zip",
        "windows_x64_msi": "",
        "macos_x64_dmg": "https://github.com/alimtvnetwork/Antigravity-Manager/releases/download/v4.240.0/Antigravity.Manager.Tools_4.240.0_x64.dmg",
        "macos_aarch64_dmg": "https://github.com/alimtvnetwork/Antigravity-Manager/releases/download/v4.240.0/Antigravity.Manager.Tools_4.240.0_aarch64.dmg",
        "linux_amd64_appimage": "",
        "linux_aarch64_appimage": "",
        "linux_amd64_deb": "https://github.com/alimtvnetwork/Antigravity-Manager/releases/download/v4.240.0/Antigravity.Manager.Tools_4.240.0_amd64.deb",
        "linux_aarch64_deb": "https://github.com/alimtvnetwork/Antigravity-Manager/releases/download/v4.240.0/Antigravity.Manager.Tools_4.240.0_arm64.deb",
        "linux_x64_rpm": "",
        "linux_aarch64_rpm": ""
      }
    },
    {
      "version": "4.239.0",
      "tag": "v4.239.0",
      "tag_url": "https://github.com/alimtvnetwork/Antigravity-Manager/releases/tag/v4.239.0",
      "raw_tag_url": "https://raw.githubusercontent.com/alimtvnetwork/Antigravity-Manager/v4.239.0",
      "release_url": "https://github.com/alimtvnetwork/Antigravity-Manager/releases/tag/v4.239.0",
      "published_at": "2026-10-20T03:31:45Z",
      "prerelease": false,
      "assets": {
        "windows_x64_setup": "https://github.com/alimtvnetwork/Antigravity-Manager/releases/download/v4.239.0/agm-alim-setup.exe",
        "windows_x64_zip": "https://github.com/alimtvnetwork/Antigravity-Manager/releases/download/v4.239.0/agm-alim_4.239.0_windows_x64.zip",
        "windows_x64_msi": "",
        "macos_x64_dmg": "https://github.com/alimtvnetwork/Antigravity-Manager/releases/download/v4.239.0/Antigravity.Manager.Tools_4.239.0_x64.dmg",
        "macos_aarch64_dmg": "https://github.com/alimtvnetwork/Antigravity-Manager/releases/download/v4.239.0/Antigravity.Manager.Tools_4.239.0_aarch64.dmg",
        "linux_amd64_appimage": "",
        "linux_aarch64_appimage": "",
        "linux_amd64_deb": "https://github.com/alimtvnetwork/Antigravity-Manager/releases/download/v4.239.0/Antigravity.Manager.Tools_4.239.0_amd64.deb",
        "linux_aarch64_deb": "https://github.com/alimtvnetwork/Antigravity-Manager/releases/download/v4.239.0/Antigravity.Manager.Tools_4.239.0_arm64.deb",
        "linux_x64_rpm": "",
        "linux_aarch64_rpm": ""
      }
    },
    {
      "version": "4.238.7",
      "tag": "v4.238.7",
      "tag_url": "https://github.com/alimtvnetwork/Antigravity-Manager/releases/tag/v4.238.7",
      "raw_tag_url": "https://raw.githubusercontent.com/alimtvnetwork/Antigravity-Manager/v4.238.7",
      "release_url": "https://github.com/alimtvnetwork/Antigravity-Manager/releases/tag/v4.238.7",
      "published_at": "2026-10-20T01:34:01Z",
      "prerelease": false,
      "assets": {
        "windows_x64_setup": "https://github.com/alimtvnetwork/Antigravity-Manager/releases/download/v4.238.7/agm-alim-setup.exe",
        "windows_x64_zip": "https://github.com/alimtvnetwork/Antigravity-Manager/releases/download/v4.238.7/agm-alim_4.238.7_windows_x64.zip",
        "windows_x64_msi": "",
        "macos_x64_dmg": "https://github.com/alimtvnetwork/Antigravity-Manager/releases/download/v4.238.7/Antigravity.Manager.Tools_4.238.7_x64.dmg",
        "macos_aarch64_dmg": "https://github.com/alimtvnetwork/Antigravity-Manager/releases/download/v4.238.7/Antigravity.Manager.Tools_4.238.7_aarch64.dmg",
        "linux_amd64_appimage": "",
        "linux_aarch64_appimage": "",
        "linux_amd64_deb": "https://github.com/alimtvnetwork/Antigravity-Manager/releases/download/v4.238.7/Antigravity.Manager.Tools_4.238.7_amd64.deb",
        "linux_aarch64_deb": "https://github.com/alimtvnetwork/Antigravity-Manager/releases/download/v4.238.7/Antigravity.Manager.Tools_4.238.7_arm64.deb",
        "linux_x64_rpm": "",
        "linux_aarch64_rpm": ""
      }
    },
    {
      "version": "4.238.0",
      "tag": "v4.238.0",
      "tag_url": "https://github.com/alimtvnetwork/Antigravity-Manager/releases/tag/v4.238.0",
      "raw_tag_url": "https://raw.githubusercontent.com/alimtvnetwork/Antigravity-Manager/v4.238.0",
      "release_url": "https://github.com/alimtvnetwork/Antigravity-Manager/releases/tag/v4.238.0",
      "published_at": "2026-10-19T14:22:08Z",
      "prerelease": false,
      "assets": {
        "windows_x64_setup": "https://github.com/alimtvnetwork/Antigravity-Manager/releases/download/v4.238.0/agm-alim-setup.exe",
        "windows_x64_zip": "https://github.com/alimtvnetwork/Antigravity-Manager/releases/download/v4.238.0/agm-alim_4.238.0_windows_x64.zip",
        "windows_x64_msi": "",
        "macos_x64_dmg": "https://github.com/alimtvnetwork/Antigravity-Manager/releases/download/v4.238.0/Antigravity.Manager.Tools_4.238.0_x64.dmg",
        "macos_aarch64_dmg": "https://github.com/alimtvnetwork/Antigravity-Manager/releases/download/v4.238.0/Antigravity.Manager.Tools_4.238.0_aarch64.dmg",
        "linux_amd64_appimage": "",
        "linux_aarch64_appimage": "",
        "linux_amd64_deb": "https://github.com/alimtvnetwork/Antigravity-Manager/releases/download/v4.238.0/Antigravity.Manager.Tools_4.238.0_amd64.deb",
        "linux_aarch64_deb": "https://github.com/alimtvnetwork/Antigravity-Manager/releases/download/v4.238.0/Antigravity.Manager.Tools_4.238.0_arm64.deb",
        "linux_x64_rpm": "",
        "linux_aarch64_rpm": ""
      }
    },
    {
      "version": "4.237.0",
      "tag": "v4.237.0",
      "tag_url": "https://github.com/alimtvnetwork/Antigravity-Manager/releases/tag/v4.237.0",
      "raw_tag_url": "https://raw.githubusercontent.com/alimtvnetwork/Antigravity-Manager/v4.237.0",
      "release_url": "https://github.com/alimtvnetwork/Antigravity-Manager/releases/tag/v4.237.0",
      "published_at": "2026-10-19T11:49:44Z",
      "prerelease": false,
      "assets": {
        "windows_x64_setup": "https://github.com/alimtvnetwork/Antigravity-Manager/releases/download/v4.237.0/agm-alim-setup.exe",
        "windows_x64_zip": "https://github.com/alimtvnetwork/Antigravity-Manager/releases/download/v4.237.0/agm-alim_4.237.0_windows_x64.zip",
        "windows_x64_msi": "",
        "macos_x64_dmg": "https://github.com/alimtvnetwork/Antigravity-Manager/releases/download/v4.237.0/Antigravity.Manager.Tools_4.237.0_x64.dmg",
        "macos_aarch64_dmg": "https://github.com/alimtvnetwork/Antigravity-Manager/releases/download/v4.237.0/Antigravity.Manager.Tools_4.237.0_aarch64.dmg",
        "linux_amd64_appimage": "",
        "linux_aarch64_appimage": "",
        "linux_amd64_deb": "https://github.com/alimtvnetwork/Antigravity-Manager/releases/download/v4.237.0/Antigravity.Manager.Tools_4.237.0_amd64.deb",
        "linux_aarch64_deb": "https://github.com/alimtvnetwork/Antigravity-Manager/releases/download/v4.237.0/Antigravity.Manager.Tools_4.237.0_arm64.deb",
        "linux_x64_rpm": "",
        "linux_aarch64_rpm": ""
      }
    },
    {
      "version": "4.236.0",
      "tag": "v4.236.0",
      "tag_url": "https://github.com/alimtvnetwork/Antigravity-Manager/releases/tag/v4.236.0",
      "raw_tag_url": "https://raw.githubusercontent.com/alimtvnetwork/Antigravity-Manager/v4.236.0",
      "release_url": "https://github.com/alimtvnetwork/Antigravity-Manager/releases/tag/v4.236.0",